{"admission_policy_ref":"sg:policy/material-admission-v2","admission_policy_version_id":"sg:policy/material-admission-v2@sha256:1bfe3a30d62913fcf5647b5af03e07be8e128f83c78c133442748f535c8e9ed3","materials":[{"byte_length":3667,"domain":"layout","lifecycle":"generated","media_type":"text/markdown","record_kind":"material","repository_path":"patterns/grid-repetition/page-grid.md","schema_version":"2.0","source_sha256":"e2e49d1a86e6ae4b0f272573c6517edd593e6f25dc7d96f73307795abf000f41","stable_ref":"sg:material/path-sha256-002803d65d057faaa4e8c1bb3e32ef3f41032b011251fc9f0f7b1db907b01ceb","version_id":"sg:material/path-sha256-002803d65d057faaa4e8c1bb3e32ef3f41032b011251fc9f0f7b1db907b01ceb@sha256:e2e49d1a86e6ae4b0f272573c6517edd593e6f25dc7d96f73307795abf000f41"},{"byte_length":3546,"domain":"layout","lifecycle":"generated","media_type":"text/markdown","record_kind":"material","repository_path":"patterns/in-line-grouping/pagination.md","schema_version":"2.0","source_sha256":"cff90e8758b703bec4e48b88970e194b8b11528e33f5111fc82caaad5c5313c1","stable_ref":"sg:material/path-sha256-00ae3be01fcc4add55bd98eff34737037c54c0a7f2f128239a2afbe698936c8f","version_id":"sg:material/path-sha256-00ae3be01fcc4add55bd98eff34737037c54c0a7f2f128239a2afbe698936c8f@sha256:cff90e8758b703bec4e48b88970e194b8b11528e33f5111fc82caaad5c5313c1"},{"byte_length":99659,"domain":"shared","lifecycle":"stable","media_type":"text/markdown","record_kind":"material","repository_path":"quality/claim-records/samples.md","schema_version":"2.0","source_sha256":"0cf5df12d9a34ef0968479047bf24ab3163dc53715f32c86c40f03a121aef653","stable_ref":"sg:material/path-sha256-021f96adf1d1647d17f99011af6b1e7fa370dddbbad96b384731ed0256f74984","version_id":"sg:material/path-sha256-021f96adf1d1647d17f99011af6b1e7fa370dddbbad96b384731ed0256f74984@sha256:0cf5df12d9a34ef0968479047bf24ab3163dc53715f32c86c40f03a121aef653"},{"byte_length":3592,"domain":"design-engineering","lifecycle":"experimental","media_type":"text/markdown","record_kind":"material","repository_path":"design-engineering/state-management/patterns/draft-and-baseline.md","schema_version":"2.0","source_sha256":"faff27c0b376341dc8142bcdd9bfed4e73ea894d1e1a3eb9078202070ccc0261","stable_ref":"sg:material/path-sha256-02ec455439cc41949cf6f6a9a66466d17eeecf4a55a8698ffb3d5741a18f3194","version_id":"sg:material/path-sha256-02ec455439cc41949cf6f6a9a66466d17eeecf4a55a8698ffb3d5741a18f3194@sha256:faff27c0b376341dc8142bcdd9bfed4e73ea894d1e1a3eb9078202070ccc0261"},{"byte_length":858,"domain":"layout","lifecycle":"generated","media_type":"text/markdown","record_kind":"material","repository_path":"patterns/viewport-shell/index.md","schema_version":"2.0","source_sha256":"05da91c5514d03e82c19a03c494fdad21a92a2ba7b88ec6dca5e7836c1f133a2","stable_ref":"sg:material/path-sha256-040de79bdf5af768663bf1aaa9d7451aa0d79bfaa0d5e982cceec4058f7715e4","version_id":"sg:material/path-sha256-040de79bdf5af768663bf1aaa9d7451aa0d79bfaa0d5e982cceec4058f7715e4@sha256:05da91c5514d03e82c19a03c494fdad21a92a2ba7b88ec6dca5e7836c1f133a2"},{"byte_length":5367,"domain":"design-engineering","lifecycle":"experimental","media_type":"text/markdown","record_kind":"material","repository_path":"design-engineering/interface-craft.md","schema_version":"2.0","source_sha256":"ba71e914027abd783e9769a5b91efb764cc7335a6479c69ca4e70ab05a64e941","stable_ref":"sg:material/path-sha256-04afb6013755c328be25b08637961e5f20fa67705cfcbd6e996ba6ada944f571","version_id":"sg:material/path-sha256-04afb6013755c328be25b08637961e5f20fa67705cfcbd6e996ba6ada944f571@sha256:ba71e914027abd783e9769a5b91efb764cc7335a6479c69ca4e70ab05a64e941"},{"byte_length":501,"domain":"layout","lifecycle":"generated","media_type":"text/markdown","record_kind":"material","repository_path":"patterns/stacking/index.md","schema_version":"2.0","source_sha256":"9b60182a25c4c07b7b482b3981dec17d515f95915cc618411282f988dca4ada2","stable_ref":"sg:material/path-sha256-04fa96b121ed2a48be80851efc72289752d1c4c12bd6433c2d5002d6d82a54ed","version_id":"sg:material/path-sha256-04fa96b121ed2a48be80851efc72289752d1c4c12bd6433c2d5002d6d82a54ed@sha256:9b60182a25c4c07b7b482b3981dec17d515f95915cc618411282f988dca4ada2"},{"byte_length":6853,"domain":"motion","lifecycle":"experimental","media_type":"text/markdown","record_kind":"material","repository_path":"motion/vocabulary.md","schema_version":"2.0","source_sha256":"b2796979aaa1b194ff3006469cbeaec71cbd80d1484e3a5089e03295a43b464d","stable_ref":"sg:material/path-sha256-07b5ed44416e4d40efd213a7e944f214a338aa83201e52ba58c6dcf2a81e5675","version_id":"sg:material/path-sha256-07b5ed44416e4d40efd213a7e944f214a338aa83201e52ba58c6dcf2a81e5675@sha256:b2796979aaa1b194ff3006469cbeaec71cbd80d1484e3a5089e03295a43b464d"},{"byte_length":1619,"domain":"shared","lifecycle":"stable","media_type":"text/markdown","record_kind":"material","repository_path":"quality/gates/visual-evidence.md","schema_version":"2.0","source_sha256":"17f7430f1cd1847c74c737ee9341120be6b49e827ec4228be5b6868669d27fd3","stable_ref":"sg:material/path-sha256-085c94936dece089fd31864c482d1a19e4da562951adbaa7d459e0126486d149","version_id":"sg:material/path-sha256-085c94936dece089fd31864c482d1a19e4da562951adbaa7d459e0126486d149@sha256:17f7430f1cd1847c74c737ee9341120be6b49e827ec4228be5b6868669d27fd3"},{"byte_length":8322,"domain":"design-engineering","lifecycle":"experimental","media_type":"text/markdown","record_kind":"material","repository_path":"design-engineering/component-contract.md","schema_version":"2.0","source_sha256":"79e496160e28ab26397d2c5b68075fd14c732d13002ff6c6e41c031d86cac039","stable_ref":"sg:material/path-sha256-08adbcce8042dbb84d03e0903f204eb9f799d464a2035c84db9ffab8aebcc278","version_id":"sg:material/path-sha256-08adbcce8042dbb84d03e0903f204eb9f799d464a2035c84db9ffab8aebcc278@sha256:79e496160e28ab26397d2c5b68075fd14c732d13002ff6c6e41c031d86cac039"},{"byte_length":54,"domain":"shared","lifecycle":"stable","media_type":"text/markdown","record_kind":"material","repository_path":"quality/claim-records/index.md","schema_version":"2.0","source_sha256":"b9bb90f0928f7f408c615ce2dc323425640ef4b83b62de0c0dee6dcd4bf7e3bb","stable_ref":"sg:material/path-sha256-08c3095acfdc040b75071e94644db6a32b655817c4b79eabfa4339b59c9f0b22","version_id":"sg:material/path-sha256-08c3095acfdc040b75071e94644db6a32b655817c4b79eabfa4339b59c9f0b22@sha256:b9bb90f0928f7f408c615ce2dc323425640ef4b83b62de0c0dee6dcd4bf7e3bb"},{"byte_length":4089,"domain":"shared","lifecycle":"stable","media_type":"text/markdown","record_kind":"material","repository_path":"quality/gates/harmony-evaluation.md","schema_version":"2.0","source_sha256":"efee2c0ff6a662bc3efb360ee8c80defc5113a00d8b36e1c36c45eb63d330270","stable_ref":"sg:material/path-sha256-0a43f2af49d24f33b8ff06829d431f9e7608de57760c3f2c7de8c3e4126869f3","version_id":"sg:material/path-sha256-0a43f2af49d24f33b8ff06829d431f9e7608de57760c3f2c7de8c3e4126869f3@sha256:efee2c0ff6a662bc3efb360ee8c80defc5113a00d8b36e1c36c45eb63d330270"},{"byte_length":8047,"domain":"platform-guides","lifecycle":"experimental","media_type":"text/markdown","record_kind":"material","repository_path":"platform-guides/preferences-and-accessibility.md","schema_version":"2.0","source_sha256":"d5a2af1cb445d0be4d0ed0a61f281673e4be81041dc964f8b16e3e7d6284a55e","stable_ref":"sg:material/path-sha256-0b82930e378484f7b84e5834e89e1c153e5d0993b26b38524bfd4153fcfc5438","version_id":"sg:material/path-sha256-0b82930e378484f7b84e5834e89e1c153e5d0993b26b38524bfd4153fcfc5438@sha256:d5a2af1cb445d0be4d0ed0a61f281673e4be81041dc964f8b16e3e7d6284a55e"},{"byte_length":3999,"domain":"layout","lifecycle":"generated","media_type":"text/markdown","record_kind":"material","repository_path":"patterns/viewport-shell/scroll-body-shell.md","schema_version":"2.0","source_sha256":"884fd867f233619f3f94f965d87016eeac6727608dd5c6423c8221687ff31b61","stable_ref":"sg:material/path-sha256-10f553c3d6a39c31ca1a5b8f56db6afb75709d8706d125c6f0d891f46b1f11b4","version_id":"sg:material/path-sha256-10f553c3d6a39c31ca1a5b8f56db6afb75709d8706d125c6f0d891f46b1f11b4@sha256:884fd867f233619f3f94f965d87016eeac6727608dd5c6423c8221687ff31b61"},{"byte_length":3560,"domain":"expression","lifecycle":"experimental","media_type":"text/markdown","record_kind":"material","repository_path":"expression/directions/warm-print.md","schema_version":"2.0","source_sha256":"27480a96687e0173caddef5fc8ab3ebec670768ebb365056c68a752944ef59d6","stable_ref":"sg:material/path-sha256-12964187eb48074073f1e42019f579fd946905a2f2ff72f5f59f345f95db13f2","version_id":"sg:material/path-sha256-12964187eb48074073f1e42019f579fd946905a2f2ff72f5f59f345f95db13f2@sha256:27480a96687e0173caddef5fc8ab3ebec670768ebb365056c68a752944ef59d6"},{"byte_length":6556,"domain":"layout","lifecycle":"stable","media_type":"text/markdown","record_kind":"material","repository_path":"recipes/homepage.md","schema_version":"2.0","source_sha256":"b23555fc59b5899ef414ba697c7aa3b39a3126f48d8b341b98489140f3a6a44f","stable_ref":"sg:material/path-sha256-14e127a7c719ee8494096a98b25b32d26363c1845bddcd912f50f6b1e2b84b46","version_id":"sg:material/path-sha256-14e127a7c719ee8494096a98b25b32d26363c1845bddcd912f50f6b1e2b84b46@sha256:b23555fc59b5899ef414ba697c7aa3b39a3126f48d8b341b98489140f3a6a44f"},{"byte_length":3532,"domain":"layout","lifecycle":"generated","media_type":"text/markdown","record_kind":"material","repository_path":"patterns/overlay-exception/overlay-stack.md","schema_version":"2.0","source_sha256":"ae8d8c8a546802f8bf6d593606b008523874d258914ccf45ed8246094f775581","stable_ref":"sg:material/path-sha256-15dd8f3d84fb50f1442bd8c9732356759849f7d87f1d66b004eeb5d9ea75a4a9","version_id":"sg:material/path-sha256-15dd8f3d84fb50f1442bd8c9732356759849f7d87f1d66b004eeb5d9ea75a4a9@sha256:ae8d8c8a546802f8bf6d593606b008523874d258914ccf45ed8246094f775581"},{"byte_length":901,"domain":"shared","lifecycle":"stable","media_type":"text/markdown","record_kind":"material","repository_path":"quality/evidence/design-rationale.md","schema_version":"2.0","source_sha256":"f2215fa79133